Title,Content,Date
Promoting diversity in science,"For biologist Jessica Ford, pursuing a lifelong interest in herpetology – the study of amphibians and reptiles or, as Ford puts it, “things that live in the mud” – hasn’t always been easy.“From my elementary school experience through to undergrad, I’ve had people telling me, ‘Maybe you should reconsider,’ ‘Maybe you shouldn’t be doing this,’ ‘Maybe science isn’t for you.’“There’s very little that makes you feel so much like you can’t do something as someone explicitly telling you that you should reconsider.”But far from being deterred from following a path she was told was “weird for a girl,” Ford leaned in. She’s now a PhD student at the Redpath Museum, studying the effect of toad tadpoles on their aquatic ecosystems. She also serves as chair of STEMM diversity @ McGill, a group she helped found as an undergraduate student in 2017, which is devoted to promoting diversity in STEMM (science, technology, engineering, mathematics and medicine), and providing resources to young women and girls considering careers in those traditionally male-dominated fields.Found her passion in childhoodLike many young children, Ford spent lots of time playing in mud and dirt. She quickly became fascinated with the animal life she encountered, becoming curious about those animals and their environments. That fascination grew into a passion for ecology and conservation, though as a child, she didn’t understand that her curiosity counted as science.“I never saw anyone represented in science who I could relate to, and didn’t realize scientists could be emotional or creative,” Ford recalls.Around that time, Ford began to hear the derisive comments about girls taking an interest in science,  which persisted in one form or another throughout her life.“I could tell that I was being treated differently,” she says. “In elementary school, no one was calling the boys weird for being interested in the ‘creepy crawlies.’ In high school, my male peers could ask for help without being told maybe they should reconsider their scientific pursuits, or that they wouldn’t make it in science if they were so emotional.”Eventually, she was able to overcome the negativity around her because of her passion, her stubbornness, and her support network of family, friends and mentors.“I had decided at a young age that studying and conserving reptiles and amphibians this was something I cared about, and I wasn’t going to let anything stand in my way,” Ford says. “I would motivate myself by proving people wrong and showing them that I really could do all these things they would say I couldn’t.”“You can have a place here, too”During her first semester as an undergraduate, she found out to her frustration that after all the hurdles and the pushback she overcame to make it into university, the dismissive comments persisted.“I worked up the courage to ask a professor a question after class, which I was pretty nervous about,” Ford says. “After the professor finished answering a classmate’s question, I asked him mine, and instead of an answer, I was treated to ‘Well, if you don’t understand that, you really shouldn’t be in science.’“At the moment I cried, as people do, but I decided to channel my frustration and try to make a difference, so that others wouldn’t have to overcome so much to get to where I was.”That incident was a catalyst which persuaded her to join forces with Charles Xu, a graduate student who was looking for ways to draw attention to issues of equality, diversity and inclusion in scientific fields, to create STEMM Diversity @ McGill. One of her first initiatives as part of the group was to write and illustrate a colouring and activity book for kids, to introduce young children to scientists from underrepresented backgrounds who have made significant contributions in STEMM fields – something Ford wishes she was exposed to when she was a child.“Something I find really empowering is finding someone who reminds me of me – someone I can identify with who is doing what I want to do,” she says. “[I wanted to offer kids] something that really spoke to them and explained there’s lots of people who do science. We all look different, and you can have a place here, too.”She also helped create a mentorship program for university students, and has given outreach talks to schools, libraries, and the Girl Guides of Canada.Ford also acknowledges that while she has overcome many obstacles during her journey, she recognizes the advantage she has of being a white woman.“I think it is important to remember just how much harder this is for BIPOC, queer, disabled, and any intersectionality of that, women. It is also important to remember those that were pushed out and excluded from pursuing their dreams in STEMM. We all have a place in this fight for a better STEMM community, and need to ensure that the future of STEMM is a just one.”","Thu, 02/10/2022 - 09:58"
McGill pushes forward to embed sustainability in the curriculum,"“No university can lead globally in the 21st century without putting sustainability at the centre of its operations, research, and teaching,” reads the McGill University Strategic Plan 2017-2022.And the McGill community agrees; in response to last year’s Sustainability Survey, 93 percent of students are interested in learning about sustainability themes and challenges, while 72 percent of faculty members are interested in incorporating sustainability in courses.Jessica Latus is McGill’s first Sustainability Officer with the mandate to bolster sustainability in teaching and learning activities.To address this cross-campus desire, the Associate Provost (Teaching and Academic Programs) and Office of Sustainability have established a new full-time position with a focus on supporting and expanding sustainability-related teaching and learning opportunities at the University. This position was made possible thanks to support from the Principal’s Office.“Sustainability challenges are interdisciplinary in nature,” says Principal Suzanne Fortier. “We are proud to offer our students, irrespective of their area of focus, the opportunity to engage in sustainability and learn how they may play a role in creating a sustainable future.”The incoming Sustainability Officer, Jessica Latus, comes to McGill from the University of British Columbia (UBC)’s Centre for Sustainable Food Systems at UBC Farm where she managed their knowledge mobilization and translation efforts, expanding upon her experience in program management and development, strategic planning, and stakeholder engagement and facilitation. She holds a Master’s degree in urban ecology from the University of Helsinki and a Bachelor’s degree in biology from Arizona State University.“I am honored to take on this important role,” says Latus. “I feel passionately that universities are a key component in achieving the United Nations Sustainable Development Goals (SDGs). To help meet this mission, universities need to ensure that sustainability is embedded across disciplines so that students can address the grand challenges of the 21st century.”Advancing McGill’s sustainability objectivesThe creation of the Sustainability Officer position aligns with the actions set out in the McGill University Climate & Sustainability Strategy 2020-2025. The Research & Education category objective is to identify strategies to increase learning and research opportunities in sustainability.Latus will play an integral role in making that happen; one of her key responsibilities includes supporting an interdisciplinary, multi-faculty committee mandated with strengthening sustainability content in the existing curriculum, identifying sustainability learning outcomes, creating resources for faculty, among other items.She will also be responsible in part for the Research & Education flagship action, which is to implement a sustainability online module available to all students, staff, and faculty members. The goal of the module is to provide foundational information about sustainability at McGill, while fostering a culture of sustainability on campus. The module will complement a new university-wide course on climate and sustainability that is currently under development.“We are looking forward to enhancing the integration of sustainability in all its forms into McGill’s teaching and learning activities,” says Dr. Laura Winer, director of Teaching and Learning Services (TLS). “In doing so, we hope to encourage greater interdisciplinary learning as we prepare our students for the future.”Latus will also bolster McGill’s leadership around the SDGs while supporting the development of an applied student research program aimed at advancing sustainability initiatives.“I believe that one of the best places to not only implement sustainable practices, but to also instil sustainable practices, is in our university system,” Latus says. “I firmly believe that young people are our future, and if we can empower them to be sustainability leaders, no matter their fields of study, then I believe we will have a chance to live in a world that is more in harmony both with nature and with each other.”Want to learn more about sustainability outside of the classroom? Participate in the Office of Sustainability’s workshop series, offered each semester in collaboration with SKILLS21 and Organizational Development, open to students, staff, and faculty.","Thu, 02/10/2022 - 01:33"
A warm gesture for a cold winter,"Victoria Kalisky (left) and her father Lorne distributing winter jackets to the homeless in Cabot Square. (Courtesy Victoria Kalisky)The plight of Montreal’s homeless is heartbreaking at the best of times, but never more than during the city’s notoriously harsh winter cold snaps. The sight of people camping out and panhandling in the frigid temperatures can leave many of us with feelings of sorrow and helplessness. But for third-year McGill Political Science student Victoria Kalisky, it was an opportunity to take bold action to make the lives of those on the streets a lot warmer.On Jan. 22, Kalisky created a GoFundMe page to raise money to purchase warm clothes for homeless Montrealers. With help from family, friends and corporate partners, she has been able to distribute hundreds of parkas and other essential winter accessories to homeless shelters throughout the city. In its first two weeks, the page has raised more than $27,000, with a goal of raising $10,000 more.“I wanted to reduce their suffering”Kalisky got the idea for the page during a routine shopping trip in her neighborhood last month. Feeling her cheeks burn up in the intense cold, she tried to imagine what life was like for those who have to spend a lot more time outdoors than the time it took her to walk a few blocks.“I see the Milton Park urban Indigenous homeless people every day,” Kalisky said. “While doing my groceries in -30°, I felt disturbed by the idea that men and women would spend their entire night in that painful cold. I wanted to reduce their suffering.”At around the same time, she read a news story about a woman in her 60s who was found dead outside an entrance to the Berri-UQAM metro station on a night when temperatures dipped well below -20°C. It was the second time in 10 days that an unhoused Montrealer died from exposure to extreme conditions.This winter has been an especially harsh one for those without a place to call home. While an average January in Montreal would see overnight lows dip below -20°C eight times, this past month saw that happen 17 times. Making matters worse, space restrictions at shelters dictated by the COVID-19 pandemic are forcing more people than usual out into the streets at night.A team effortThe response to Kalisky’s GoFundMe effort was swift. Her father Lorne, the owner of a liquidation business, got some corporate friends to donate about $6,000 on the first day. As word of the fundraising effort spread in the media, donations continued to pour in steadily. He spoke with a local distributor about purchasing the coats, managing to get hundreds of them, normally valued at $300 apiece, for just $20 each. Meanwhile, Kalisky spoke with Nakuset, the executive director of the Native Women’s Shelter, about coordinating the delivery.“Our team spent the next few days delivering and distributing coats to homeless shelters,” Kalisky said. “During our first delivery at Cabot Square, we handed out 150 coats in thirty minutes. Undertaking an emergency initiative like this at a quick pace requires a combination of talking to local experts, fundraising, logistical support, and being present and empathetic.”Kalisky’s team has so far delivered 732 winter coats, along with 1,200 hats, 1,000 pairs of gloves, 232 children’s snowsuits, and 165 children’s coats to several local charities, including the Native Women’s Shelter, Resilience Montreal, the Open Door, and La Maison du Père. She says as long as the donations roll in and the situation remains urgent, she and her team will continue purchasing and handing out winter clothes.Kindness spreadsApart from easing the immediate needs of those in need, Kalisky hopes her efforts can inspire other people to take action. In addition to the cash donations, she has received a flood of emails from people offer their own winter clothes. A local fruit supplier has also donated about 2,000 oranges for shelters, and a medical equipment supplier has donated 2,000 face masks.Meanwhile, her efforts have also inspired people outside the city.“After hearing about this fundraiser, an individual in Toronto purchased 1,000 winter jackets for Toronto’s homeless,” Kalisky said. “A student in Quebec City has also expressed interest in organizing this initiative for their homeless community.”Governor-General Mary Simon also offered praise for the Kalisky’s efforts. During a recent interview with Montreal radio station CJAD 800, Simon thanked the Kaliskys for their compassion and their proactive approach to helping those in need. Meanwhile, Lorne Kalisky told the radio station that given the overwhelming need they’ve seen on the streets this winter, they are considering making this an annual campaign.","Tue, 02/08/2022 - 11:09"
Madame Iona spreads kindness during COVID,"Iona Amico is the recipient of the 2021 Jackie Robinson Undergraduate Award, given to students from the Black community who demonstrate both academic excellence and community involvementBASF Picture“You shouldn’t even have the right to education…you’re Black” were the hateful words said to Iona Amico by a fellow grade one student many years ago. Born in France and raised in Quebec, Iona Amico is the daughter of a Cameroonian mom and an Italian dad who grew up biracial in a predominantly Caucasian neighbourhood. Despite having faced incidents of bigotry and feeling like she was between two worlds, she did not let these experiences jade her.Quite the contrary; today Amico is a third-year Bachelor of Education Kindergarten and Elementary student who has gone above and beyond to spread joy and perform acts of kindness, particularly during the pandemic. As a result, she is the proud recipient of the 2021 Jackie Robinson Undergraduate Award. Bestowed by the Black Academic Scholarships Fund, this award is given to students from the Black community who demonstrate both academic excellence and community involvement.“COVID created an urge in me to help others and especially parents who were homeschooling their children,” said Amico, reflecting on the initial school closures of March 2020. Describing those initial weeks of stressful uncertainty, Amico felt particularly devastated by the disruption to the lives of young children. Motivated to find solutions to these new problems, Amico shared educational tools and resources on Facebook and Instragram. “I called these pages ‘Madame Iona,’ which is my teacher name in schools.”Parents who feared their children’s level of French would regress began contacting “Madame Iona” for help. Amico said she derived immense enjoyment in creating educational resources and in providing free online tutoring. “I decided to keep offering free tutoring services because this was my way of doing my part during those difficult times. For me, solidarity and generosity were really what was needed during the pandemic.”Teaching super powersWhen in-person teaching resumed, Amico began her 15-week internship in Brossard’s Harold Napper School. Despite the many challenges of being a student-teacher during COVID, Amico’s passion for education and her commitment to children fuelled her. “Working with a mask while respecting strict sanitary restrictions has been challenging, but one of our super powers as teachers is that we have this capacity to adapt quite well,” she said. “I have also been very surprised by how resilient children are.”While completing her internship, Amico championed a book drive to help renew the library of a local Montreal youth center and got the teachers at Harold Napper School involved. “Thanks to the students’ participation, we were also able to distribute Christmas cards to each of the 144 youth at the center.”‘A rare gem’Amico even surprised the entire school staff with a crepe bar. “I know that the teaching profession is not always appreciated, and I really wanted to show my colleagues that they are important and valued. Seeing my colleagues’ faces light up made my work so worth it!”Cooperating Teacher, Nathalie Leblanc, described Amico to be a dynamic and professional intern. “Iona has set the bar very high for my future stagières. She is a rare gem and the next generation of teachers that the school environment needs.”","Mon, 02/07/2022 - 15:31"
Engineering student joins 2041 ClimateForce Antarctic Expedition,"For many students, spring break means going south. For fourth-year Chemical and Environmental Engineering student Quang Anh Nguyen, this year’s spring break will mean going as far south as one can possibly go.From March 17 to 28, Nguyen will join a global team of young leaders on the 2041 ClimateForce Antarctic Expedition – a trip he hopes will help others understand the urgency of the current climate crisis.Nguyen will fly to the southernmost city in the world, Ushuaia, Argentina, and journey through the Drake Passage to reach Antarctica. Once there, it’ll be time for ice trekking, volcanic sightings, and daily journeys to see penguins, glaciers, and sprawling mountains. In addition, he’ll listen to experts discuss climate science, renewable energy, and leadership development. He plans to document his journey on his Instagram, Facebook and LinkedIn accounts.From Vietnam to AntarcticaQuang Anh NguyenA native of Vietnam, Nguyen says he became interested in the issue of climate change in middle school, after hearing a program on a car radio about how thousands of species were lost every year due to changing climate patterns.“What was even more shocking was how the driver casually switched the radio channel after that,” he said. “It did not reconcile with me how many of us don’t even think twice about the huge amounts of animals that were going extinct because we disregard it as one of those ‘out there’ issues that is for someone else to solve.”By the time he reached high school, he understood that the climate crisis was the single greatest issue of his generation, and he began to educate himself more about environmental issues. From there, his interest moved toward how humans can deploy green innovations, such as clean energy and regenerative agriculture, to help minimize the damage to the Earth’s environment.Nguyen brought his passion for the issue to Canada, and to McGill, in 2018, where he began his Chemical Engineering undergraduate degree, with a minor in Environmental Engineering. He is now the co-president of the Research and Sustainability Network, an SSMU club aimed at bridging the gap between students and sustainability academia and careers. Last year, Nguyen joined with five others in creating the 200 Urban Garden, which aims to set up 200 new gardens in Montreal by turning underused pockets of land into lively greenspaces. The project was one of the ten finalists for the impact200 Sustainability Challenge, launched as part of McGill’s Bicentennial celebrations.‘Insanely cool’The organizers of the Antarctic expedition, the 2041 Foundation, recently approached Nguyen about making the long journey to Antarctica. Nguyen decided to apply for two reasons.“Firstly, going to Antarctica is a once-in-a-lifetime opportunity to see some of the most pristine ecosystems in the world,” he says. “In other words, it’s insanely cool!“Beyond that, I aim to leverage the trip to better understand how I can create greater impact and encourage more people and organizations to adopt sustainable practices. I hope that by sharing a different side to sustainability and showing the grand beauty behind nature, I can inspire people who might not have been ardent climate advocates to start caring more about it.”Corporate sponsors, including Maple Leaf Foods and Ontario Power Generation, are helping Nguyen raise the bulk of the $22,000 he needs to fund the trip. He set up a GoFundMe page to help raise the rest.Once he returns, Nguyen has already lined up workshops to share his reflections. For the moment, he sees the trip as an exciting, once-in-a-lifetime opportunity.“Coming from a small tropical city, Antarctica was the farthest thing from my imagination of possibilities,” he says. “I didn’t even think that ‘normal’ people could even go that far. So really, it was about believing in myself and that I can make the trip happen.”","Mon, 02/07/2022 - 13:21"
