Title,Content,Date
What to expect at Global Health Week,"Running from May 16 to 20, Global Health Week is a key signature event of McGill’s Bicentennial celebrations.The Bicentennial is an opportunity to bring the McGill global health community together to celebrate the University’s legacy in global and public health and to highlight the tradition of excellence and collaboration across all McGill campuses, affiliated hospitals and research institutes, all the while raising the profile of our partners that continue to make a difference in Montreal, and around the world.Built around the overarching theme ‘Providing Solutions to Global Challenges,’ Global Health Week is comprised of many events that showcase McGill University as a Canadian centre of excellence for ground-breaking global health research, advocacy and training and the home of the next generation of leaders in the field.The Annual Victor Dzau and Ruth Cooper-Dzau Distinguished Lecture in Global and Population HealthOn Wednesday, May 18, from 5:30 to 7:30 p.m. at the McGill Faculty Club Ballroom, join us in welcoming Agnes Binagwaho, Vice Chancellor of The University of Global Health Equity, as the speaker for the 2022 Victor Dzau and Ruth Cooper-Dzau Distinguished Lecture in Global and Population Health. This lecture aims to recognize outstanding leaders, while celebrating the scholarship that underscores the field’s commitment to education, research, and service to our local and global communities.Prof. Agnes Binagwaho is the Vice Chancellor of the University of Global Health Equity, an initiative of Partners in Health focused on changing the way health care is delivered around the world by training the next generation of global health professionals to deliver more equitable, quality health services for all. She is a Rwandan pediatrician who has served the health sector in various high-level government positions, first as the Executive Secretary of Rwanda’s National AIDS Control Commission, then as Permanent Secretary of the Ministry of Health, and then for five years as Minister of Health. She is a Senior Lecturer at Harvard and serves as Senior Advisor to the Director General of the World Health Organization and is a member of the United States National Academy of Medicine and a fellow of the African Academy of Sciences.In 2018, the School of Population and Global Health launched the Victor Dzau and Ruth Cooper-Dzau Distinguished Lecture in Global and Population Health. Thanks to Dr. Dzau and Mrs. Cooper-Dzau, the global health community gathers on a yearly basis to celebrate the change-makers in global and population health.Unlocking the Potential Towards Healthy Food Systems  On Wednesday, May 18, from 10 a.m. to 3:00 p.m. at the McGill Centennial Center Ballroom, visit Macdonald campus to hear about McGill students’ research and commitment in promoting a healthy and sustainable food environment for a growing world population.McGill’s Margaret A Gilliam Institute for Global Food Security in affiliation with McGill’s Global Health Community is organizing a mini-symposium as part of Global Health Week. The theme is “Unlocking the Potential Towards Healthy Food Systems” to stimulate collaboration for the synthesis of affordable and effective strategies towards the improvement of food system’s sustainable practices, based on tracking the social, economic, and environmental drivers for global health and well-being. This event will encourage alliances among different affiliates to create collaborative solutions for top issues spanning humanitarian crisis, colonization, climate change, health inequalities, socio-economic disparities, poor governance and unaffordability of nutritious food supply.Wondering how to visit Macdonald campus for this event? There will be a private bus roundtrip between both McGill campuses – 9 a.m. pick-up at Roddick Gates on the downtown campus and leaving Macdonald campus at 3 p.m. to return. A free lunch will be served during the event.Student PerspectivesOn Tuesday, May 17, from 2:30 to 4:00 p.m., at the McGill Faculty Club Ballroom, students will get the chance to speak to their peers and answer prompts on what decolonizing global health looks like. Students engaged in global health education and research at McGill University come from many disciplinary backgrounds, and in this speed-networking-style event, student are given the opportunity to exchange their ideas and learnings on what constitutes decolonization of global health. This event is created by students, for all students who are interested in global health research and practice, and jointly presented by the Canadian Association for Global Health (CAGH) McGill student chapter and McGill Global Health Programs.Lasting Legacy of the McGill-Ethiopia Community Health ProjectOn Wednesday, May 18, from 9 a.m. to 10:30 a.m., at the McGill Faculty Club Ballroom, join us for a panel to reflect upon the legacy and impact of the McGill-Ethiopia Community Health Project, which was carried out in several phases in the 1980s-1990s. The event will feature an expert panel of global health researchers who were closely involved in the project.Furthermore, McGill Health Programs will debut a screening of a 5-minute mini-documentary encapsulating the Ethiopia Community Health Project.Building Global Partnerships in Supporting Surgical Capacity in LMICsOn Thursday, May 19, from 2:30 to 4:00 p.m., at the McGill Faculty Club Ballroom, the McGill Centre for Global Surgery presents a session focuses on the importance of strong partnerships in further enhancing surgical capacity, including emergency and trauma care in lower- and middle-income countries (LMICs). We will have discussions with our partnerships including students, discussing how these partnerships, and local leadership have contributed to improved regional surgical capacity. Presented by the McGill Centre for Global Surgery.Moderated by McGill surgeons Dan Deckelbaum and Tarek Razek, this session will focus on the importance of strong partnerships in further enhancing surgical capacity, including emergency and trauma care, in lower- and middle-income countries (LMICs) and will feature presentations by experts from Senegal, Tanzania, Palestine, Mongolia, Ukraine and Nepal.To register for any of these events, see the program for Global Health Week.","Wed, 05/11/2022 - 23:18"
Exposure to wildfires increases risk of cancer,"A new study from McGill University finds higher incidence of lung cancer and brain tumors in people exposed to wildfires. The study, which tracks over two million Canadians over a period of 20 years, is the first to examine how proximity to forest fires may influence cancer risk.“Wildfires tend to happen in the same locations each year, but we know very little about the long-term health effects of these events. Our study shows that living in close proximity to wildfires may increase the risk of certain cancers,” says Scott Weichenthal, an Associate Professor in the Department of Epidemiology, Biostatistics, and Occupational Health at McGill University.Published in The Lancet Planetary Health, the study shows that people living within 50-kilometer of wildfires over the past 10 years had a 10 per cent higher incidence of brain tumours and 4.9 per cent higher incidence of lung cancer, compared to people living further away.Impacts of climate change on human healthWith the changing climate, wildfires are predicted to become more prevalent, severe, and longer in duration in the future – and they are increasingly recognized as a global health problem. “Many of the pollutants emitted by wildfires are known human carcinogens, suggesting that exposure could increase cancer risk in humans,” says Jill Korsiak, a PhD student in Weichenthal’s lab who led the analysis.Wildfires typically occur in similar regions each year, and as a result, people living in nearby communities might be exposed to carcinogenic wildfire pollutants on a chronic basis, warn the researchers.Lingering harmful pollutantsIn addition to impacts on air quality, wildfires also pollute aquatic, soil, and indoor environments. While some pollutants return to normal concentrations shortly after the fire has stopped burning, other chemicals might persist in the environment for long periods of time, including heavy metals and hydrocarbons. “Exposure to harmful environmental pollutants might continue beyond the period of active burning through several routes of exposure,” adds Weichenthal.Still, more research is necessary to understand the complex mixture of environmental pollutants released during wildfires, note the researchers. They also note that further work is needed to develop more long-term estimates of the chronic health effects of wildfires.","Wed, 05/11/2022 - 16:13"
Community spotlight: Celebrating a year of sustainability with the Environmental Residence Council,"From jumping into rigorous academics to learning to live on your own, the first year of university is not short on new experiences. Within McGill residence lies a student organization working to introduce incoming McGillians to yet another idea: sustainability.The Environmental Residence Council (ERC) is a student group working within McGill residences to promote sustainable practices through events, outreach, and campaigns. Each university residence has a representative on the ERC so that all students living on campus can voice concerns and participate in sustainable change.Jess Price, the current ERC Advisor is a second-year undergraduate student who began as a member of the council herself.  Her role is to act as a mentor and guide for incoming students on the council and assist young leaders in achieving their sustainable goals.“I started at McGill during the [COVID-19] lockdown and was struggling to find a community here. When I saw the opportunity to get involved with the council, I decided I’d give it a try,” said Price, “I got to meet like-minded people and connect with groups that I wouldn’t normally be able to. It was a really beneficial experience for me.”Providing a community for sustainability-oriented students Jess Price is the Environmental Residence Council AdvisorCourtesy of the Environmental Residence CouncilWith the goal of providing a community for new students and encouraging youth to advocate for sustainable change, the ERC has made its presence known on campus this year. From collaborating with other student organizers for Fair Trade Campus Week, clothing swaps, and workshops, this small but mighty group of incoming students is determined to make change. The group also hosted their first Go Green sustainable networking event where residents had the opportunity to connect to other student groups on campus working on sustainability.The largest success this year for the council was creating a Residence Sustainability Survey to better address the needs of students on sustainable topics, one Price was particularly passionate about.“We got great data about plant-based meal options, recycling and composting, and then we got to work with the McGill SDG Hub to understand students’ knowledge about sustainable development.”This information will help create systems to better serve students in the future, Price said.With the information from the survey, members of the ERC set out to create an information booklet and quizzes to give incoming students in future years the opportunity to learn about sustainability as soon as they step onto campus.“I can’t wait to look at the handbook once it comes out in August. The council worked really hard on this project, and I know it will help new students feel connected to sustainability at McGill right away. I’m very proud of what we’ve made, and I am so excited to see it at orientation!”Maintaining connectionsWith the pandemic still impacting students’ ability to connect, the work the ERC is doing may be more important – and challenging – than ever.“Getting students to engage, especially in the first semester, was really difficult,” Price admitted, “We were working almost entirely online still, and there was definitely some burnout from trying to connect remotely all of the time.  When you’re in a Zoom meeting, it is way more difficult to get everyone involved in the conversation, and even more difficult to make everyone feel comfortable.”Another challenge was maintaining connections on campus.“I think one of the positives was needing to lean more heavily on other groups to feel that community. ERC ended up fostering a better relationship with [the Office of Sustainability], for example, and now we have that stronger connection we can collaborate more in the future.”Despite the challenges, the ERC has created a space for students to band together and learn about campus through sustainability initiatives.“I’ve gotten to learn so much more about McGill as a school because I’ve been involved in sustainability,” Price reflected, “I’ve learned so much more about the university itself and all the amazing work being done everywhere to improve things.  It’s about more than just the environment, it’s about building community.”","Wed, 05/11/2022 - 15:30"
Celeste Pedri-Spade appointed McGill’s first Associate Provost (Indigenous Initiatives),"On May 11, 2022, Provost Christopher Manfredi announced the appointment of Prof. Celeste Pedri-Spade as McGill’s first Associate Provost (Indigenous Initiatives). Pedri-Spade’s five-year appointment begins September 1, 2022.Pedri-Spade will oversee McGill’s ongoing response to the 52 Calls to Action articulated by the Provost’s Task Force on Indigenous Studies and Indigenous Education. She will likewise work closely with academic leaders across McGill to further define the direction of McGill’s commitment to Indigenous scholars and scholarship, and to greater representation and inclusion of Indigenous peoples within the University community. She will play a critical role in furthering efforts to ensure the success of Indigenous students at McGill, and in building meaningful and active partnerships with Indigenous communities in Quebec and across Canada.Specialist in Indigenous art and decolonizationCeleste Pedri-Spade is Ojibwe scholar and artist from the Lac des Mille Lacs First Nation in northwestern OntarioAn Ojibwe scholar and artist, Pedri-Spade is from the Lac des Mille Lacs First Nation in northwestern Ontario. She is currently Associate Professor of Indigenous Studies in the School of Global Development Studies at Queen’s University, where she also holds the title of Queen’s National Scholar in Indigenous Studies. Previous to this appointment, she was an Associate Professor in the School of Northern and Community Studies and the School of Indigenous Relations at Laurentian University where she also served as the inaugural director of the Maamwizing Indigenous Research Institute, the first Indigenous Research Institute in northern Ontario.Pedri-Spade completed her PhD in visual anthropology at the University of Victoria and her MA in Culture and Communication at Royal Roads University. Her research interests include Indigenous art and decolonization; settler colonialism and Indigeneity; Indigenous visual/material culture; Anishinabemowin regeneration; and creative Indigenous research methodologies.Pedri-Spade was raised in her home territory, and prior to her academic career she held professional appointments in the area of strategic communications and media relations for various Anishinabe political-territorial organizations and service providers in northern Ontario, including Nishnawbe Aski Nation, Dilico Anishinabek Family Care, Nishnawbe Aski Legal Services Corporation and Lac des Mille Lacs First Nation. In addition to her tri-council funded projects, Prof. Pedri-Spade has also led research projects related to advancing Indigenous education for various provincial territorial organizations including the Chiefs of Ontario.At McGill, Pedri-Spade has also been appointed Associate Professor in the Department of Anthropology in the Faculty of Arts, starting September 1, 2022.","Wed, 05/11/2022 - 12:46"
McGill’s carbon reduction strategy yields outstanding results,"“Adopting a more carbon-conscious investment approach complements McGill’s far-reaching climate change and sustainability goals as well as efforts to achieve carbon neutrality across the University’s operations,” says Principal Suzanne Fortier.Neale McDevitt As part of its ongoing commitment to fighting climate change, McGill University’s result-oriented strategy has accelerated the effective decarbonization of its investment, and further reduced its exposure to large users of oil, gas, and coal, as well as fossil fuel producers. By taking a holistic approach that looks beyond the traditional carbon-intensive energy sector, the University has achieved a nearly 53 per cent absolute reduction in the carbon footprint of its two-billion-dollar endowment portfolio in just two years.This is one of the many accomplishments included in the University’s 2021 Socially Responsible Investing (SRI) annual report issued this month by McGill’s Investment Committee. “McGill University’s bold strategy has reduced the carbon emissions of its endowment investments by 78,000 tons annually, which is equivalent to taking approximately 16,800 gasoline-powered passenger vehicles off the road,” said Sophie Leblanc, Chief Investment Officer & Treasurer at McGill University. “This is about four times more than what could have been accomplished by divesting from top oil and gas reserve owners alone.”McGill’s commitment to sustainability goes back several decades. As evidenced by the sustainability statements it has signed, the University is committed to helping shape a future in which humans can thrive in a way that respects the planet.“Adopting a more carbon-conscious investment approach complements McGill’s far-reaching climate change and sustainability goals as well as efforts to achieve carbon neutrality across the University’s operations,” concluded Principal Suzanne Fortier.Many targets close, some already reachedIn April 2020, McGill’s Board of Governors approved an eight-point implementation plan for how the University will decarbonize its endowment portfolio, based on recommendations put forth in the final report of the Committee to Advise on Matters of Social Responsibility (CAMSR).The 2021 SRI report tracks key accomplishments in implementing the CAMSR recommendations “across all asset classes, such as equities, fixed income, real estate, and infrastructure.”The University has reached its target of increasing Impact Investments to five per cent, including a commitment of US $25 million in a Global Renewable Energy Fund. In total, McGill has engaged more than $100 million in investments to help transition to a zero-emission economy, covering everything from renewables to electrified transport, carbon capture, and sustainable solutions. McGill has also increased its investments in fossil-fuel-free funds to $10.8 million – more than double the initial commitment made five years ago.Other highlights of the implementation status (as of Dec. 31, 2021) include:Decarbonization: From September 2019 to December 2021, the carbon emissions of the McGill Investment Pool (MIP) listed equity portfolio have decreased by approximately 53 per cent. According to the U.S. Environmental Protection Agency’s Greenhouse Gas Equivalencies Calculator, this absolute reduction is equivalent to approximately 16,807 gasoline-powered passenger vehicles driven for one year. The relative reduction of the MIP listed equity portfolio carbon emissions now stands at 30 per cent below benchmark, which puts the University very close to meeting its 2025 target of achieving a minimum of 33 per cent carbon emissions reduction of the MIP public equities (relative to the MIP public equities benchmark).Screening: There is now $10.8 M invested in fossil-fuel-free funds, up from $9.2M this time last year. This is more than double the University’s initial commitment of $5M.Engagement: In 2021, McGill appointed SHARE as its shareholder engagement service provider to engage with the MIP’s portfolio companies on climate-related issues. Through SHARE, McGill became one of the first members of the University Network for Investor Engagement (UNIE), a university-led initiative that amplifies the voices of shareholders in addressing the drivers of climate change. Throughout 2021, SHARE has engaged with 39 portfolio’s companies on topics such as reducing greenhouse gas emissions, sustainable finance, and ensuring a just transition.Institutional leadership: Throughout 2021, the MIP’s responsible investment practices were shared with the McGill community and with other institutional investors, including foundations and universities. In April 2021, the Office of Investments hired a Governance, Compliance & ESG analyst to further support McGill’s eight SRI commitments and the development of enhanced SRI practices.The Office of Investment places critical focus on ESG integration when selecting investment management firms. As a result, 99 per cent of MIP assets are managed by managers who follow an ESG Policy or are signatories of the UNPRI. Only 70 per cent of assets were managed according to these principles in 2016.See the full progress report for more details.McGill investment policy praisedThe same week that McGill released its latest SRI report, the C.D. Howe Institute independent think-tank released its own report card for Canadian universities, noting that although divestment “can help to reduce the carbon footprint of a portfolio, it does not necessarily help to decarbonize the economy… and that carbon footprint-reduction targets must be carefully balanced, particularly as renewable energy technologies require significant amounts of fossil fuels in their production.”The C.D. Howe Institute report, called “Put to the Test: Ranking Canada’s Universities on Their Climate Change and Endowment Activities,” places McGill in the top five of 16 Canadian universities who signed the “Climate Charter for Canadian Universities” and have “made commitments to manage their assets while taking climate change into consideration.” The report singled out McGill as the only signatory to include climate-related targets directly in its investment policy.“One statement of investment policy stood out among the rest,” noted the report. “McGill University’s Statement of Investment Policy includes both its emissions-reductions targets and its targets for environmental impact investments. We would not expect to see all commitments expressly stated in investment policy statements, but, as we have noted, the gravity of climate change is such that it merits special mention.”","Tue, 05/10/2022 - 16:23"
